{
  "command": "write_change",
  "version": "v0.1",
  "target_files": ["docs/index.md"],
  "locator": "## Laufende Versuche",
  "change_type": "modify",
  "exact_before": "\n## Laufende Versuche",
  "exact_after": "## Laufende Versuche",
  "forbidden_changes": ["new sections", "content restructuring"]
}
